Sheet: Sheet1
B1: Pinout for FMC HPC connector on Mini-ITX
B2: Shareef Jalloq
B3: 2022-07-07
B6: FMC Bank C | H6: FMC Bank D | N6: FMC Bank G | U6: FMC Bank H
B7: Pin | C7: Net | D7: Type | E7: Direction | F7: ORBTrace | H7: Pin | I7: Net | J7: Type | K7: Direction | L7: ORBTrace | N7: Pin | O7: Net | P7: Type | Q7: Direction | R7: ORBTrace | S7: Function | U7: Pin | V7: Net | W7: Type | X7: Direction | Y7: ORBTrace
B8: 1 | C8: GND | D8: Power | H8: 1 | I8: PG_C2M | J8: Config | N8: 1 | O8: GND | P8: Power | U8: 1 | V8: VREF_A_M2C | W8: Power
B9: of:=[.B8]+1 -> 2 | C9: DP0_C2M_P | D9: MGT | H9: of:=[.H8]+1 -> 2 | I9: GND | J9: Power | N9: of:=[.N8]+1 -> 2 | O9: CLK0_C2M_P | P9: Clock | U9: of:=[.U8]+1 -> 2 | V9: PRSNT_M2C_L | W9: Config
B10: of:=[.B9]+1 -> 3 | C10: DP0_C2M_N | D10: MGT | H10: of:=[.H9]+1 -> 3 | I10: GND | J10: Power | N10: of:=[.N9]+1 -> 3 | O10: CLK0_C2M_N | P10: Clock | U10: of:=[.U9]+1 -> 3 | V10: GND | W10: Power
B11: of:=[.B10]+1 -> 4 | C11: GND | D11: Power | H11: of:=[.H10]+1 -> 4 | I11: GBTCLK0_M2C_P | J11: MGT | N11: of:=[.N10]+1 -> 4 | O11: GND | P11: Power | U11: of:=[.U10]+1 -> 4 | V11: CLK0_M2C_P | W11: Clock
B12: of:=[.B11]+1 -> 5 | C12: GND | D12: Power | H12: of:=[.H11]+1 -> 5 | I12: GBTCLK0_C2M_N | J12: MGT | N12: of:=[.N11]+1 -> 5 | O12: GND | P12: Power | U12: of:=[.U11]+1 -> 5 | V12: CLK0_MC2_N | W12: Clock
B13: of:=[.B12]+1 -> 6 | C13: DP0_M2C_P | D13: MGT | H13: of:=[.H12]+1 -> 6 | I13: GND | J13: Power | N13: of:=[.N12]+1 -> 6 | O13: LA00_P_CC | P13: SIO | Q13: IO | R13: EXT_9 | U13: of:=[.U12]+1 -> 6 | V13: GND | W13: Power
B14: of:=[.B13]+1 -> 7 | C14: DP0_M2C_N | D14: MGT | H14: of:=[.H13]+1 -> 7 | I14: GND | J14: Power | N14: of:=[.N13]+1 -> 7 | O14: LA00_N_CC | P14: SIO | Q14: IO | R14: EXT_11 | U14: of:=[.U13]+1 -> 7 | V14: LA02_P | W14: SIO | X14: IO | Y14: EXT_20
B15: of:=[.B14]+1 -> 8 | C15: GND | D15: Power | H15: of:=[.H14]+1 -> 8 | I15: LA01_P_CC | J15: SIO | K15: IO | L15: EXT_14 | N15: of:=[.N14]+1 -> 8 | O15: GND | P15: Power | U15: of:=[.U14]+1 -> 8 | V15: LA02_N | W15: SIO | X15: IO | Y15: EXT_22
B16: of:=[.B15]+1 -> 9 | C16: GND | D16: Power | H16: of:=[.H15]+1 -> 9 | I16: LA01_N_CC | J16: SIO | K16: IO | L16: EXT_16 | N16: of:=[.N15]+1 -> 9 | O16: LA03_P | P16: SIO | Q16: IO | R16: EXT_19 | S16: SWCLK | U16: of:=[.U15]+1 -> 9 | V16: GND | W16: Power
B17: of:=[.B16]+1 -> 10 | C17: LA06_P | D17: SIO | E17: IO | F17: EXT_13 | H17: of:=[.H16]+1 -> 10 | I17: GND | J17: Power | N17: of:=[.N16]+1 -> 10 | O17: LA03_N | P17: SIO | Q17: IO | R17: EXT_21 | S17: SWDIO | U17: of:=[.U16]+1 -> 10 | V17: LA04_P | W17: SIO | X17: IO | Y17: NC
B18: of:=[.B17]+1 -> 11 | C18: LA06_N | D18: SIO | E18: IO | F18: EXT_15 | H18: of:=[.H17]+1 -> 11 | I18: LA05_P | J18: SIO | K18: IO | L18: NC | N18: of:=[.N17]+1 -> 11 | O18: GND | P18: Power | U18: of:=[.U17]+1 -> 11 | V18: LA04_N | W18: SIO | X18: IO | Y18: NC
B19: of:=[.B18]+1 -> 12 | C19: GND | D19: Power | H19: of:=[.H18]+1 -> 12 | I19: LA05_N | J19: SIO | K19: IO | L19: NC | N19: of:=[.N18]+1 -> 12 | O19: LA08_P | P19: SIO | Q19: IO | R19: EXT_31 | U19: of:=[.U18]+1 -> 12 | V19: GND | W19: Power
B20: of:=[.B19]+1 -> 13 | C20: GND | D20: Power | H20: of:=[.H19]+1 -> 13 | I20: GND | J20: Power | N20: of:=[.N19]+1 -> 13 | O20: LA08_N | P20: SIO | Q20: IO | R20: EXT_33 | U20: of:=[.U19]+1 -> 13 | V20: LA07_P | W20: SIO | X20: IO | Y20: NC
B21: of:=[.B20]+1 -> 14 | C21: LA10_P | D21: SIO | E21: IO | F21: EXT_25 | H21: of:=[.H20]+1 -> 14 | I21: LA09_P | J21: SIO | K21: IO | L21: NC | N21: of:=[.N20]+1 -> 14 | O21: GND | P21: Power | U21: of:=[.U20]+1 -> 14 | V21: LA07_N | W21: SIO | X21: IO | Y21: NC
B22: of:=[.B21]+1 -> 15 | C22: LA10_N | D22: SIO | E22: IO | F22: EXT_27 | H22: of:=[.H21]+1 -> 15 | I22: LA09_N | J22: SIO | K22: IO | L22: NC | N22: of:=[.N21]+1 -> 15 | O22: LA12_P | P22: SIO | Q22: IO | R22: EXT_37 | U22: of:=[.U21]+1 -> 15 | V22: GND | W22: Power
B23: of:=[.B22]+1 -> 16 | C23: GND | D23: Power | H23: of:=[.H22]+1 -> 16 | I23: GND | J23: Power | N23: of:=[.N22]+1 -> 16 | O23: LA12_N | P23: SIO | Q23: IO | R23: EXT_39 | U23: of:=[.U22]+1 -> 16 | V23: LA11_P | W23: SIO | X23: IO | Y23: EXT_38
B24: of:=[.B23]+1 -> 17 | C24: GND | D24: Power | H24: of:=[.H23]+1 -> 17 | I24: LA13_P | J24: SIO | K24: IO | L24: NC | N24: of:=[.N23]+1 -> 17 | O24: GND | P24: Power | U24: of:=[.U23]+1 -> 17 | V24: LA11_N | W24: SIO | X24: IO | Y24: EXT_40
B25: of:=[.B24]+1 -> 18 | C25: LA14_P | D25: SIO | E25: IO | F25: NC | H25: of:=[.H24]+1 -> 18 | I25: LA13_N | J25: SIO | K25: IO | L25: NC | N25: of:=[.N24]+1 -> 18 | O25: LA16_P | P25: SIO | Q25: IO | R25: EXT_43 | U25: of:=[.U24]+1 -> 18 | V25: GND | W25: Power
B26: of:=[.B25]+1 -> 19 | C26: LA14_N | D26: SIO | E26: IO | F26: NC | H26: of:=[.H25]+1 -> 19 | I26: GND | J26: Power | N26: of:=[.N25]+1 -> 19 | O26: LA16_N | P26: SIO | Q26: IO | R26: EXT_45 | U26: of:=[.U25]+1 -> 19 | V26: LA15_P | W26: SIO | X26: IO | Y26: EXT_44
B27: of:=[.B26]+1 -> 20 | C27: GND | D27: Power | H27: of:=[.H26]+1 -> 20 | I27: LA17_P_CC | J27: SIO | K27: IO | L27: NC | N27: of:=[.N26]+1 -> 20 | O27: GND | P27: Power | U27: of:=[.U26]+1 -> 20 | V27: LA15_N | W27: SIO | X27: IO | Y27: EXT_46
B28: of:=[.B27]+1 -> 21 | C28: GND | D28: Power | H28: of:=[.H27]+1 -> 21 | I28: LA17_N_CC | J28: SIO | K28: IO | L28: NC | N28: of:=[.N27]+1 -> 21 | O28: LA20_P | P28: SIO | Q28: IO | R28: EXT_49 | U28: of:=[.U27]+1 -> 21 | V28: GND | W28: Power
B29: of:=[.B28]+1 -> 22 | C29: LA18_P_CC | D29: SIO | E29: IO | F29: CFG3 | H29: of:=[.H28]+1 -> 22 | I29: GND | J29: Power | N29: of:=[.N28]+1 -> 22 | O29: LA20_N | P29: SIO | Q29: IO | R29: EXT_51 | U29: of:=[.U28]+1 -> 22 | V29: LA19_P | W29: SIO | X29: IO | Y29: EXT_50
B30: of:=[.B29]+1 -> 23 | C30: LA18_N_CC | D30: SIO | E30: IO | F30: CFG4 | H30: of:=[.H29]+1 -> 23 | I30: LA23_P | J30: SIO | K30: IO | L30: NC | N30: of:=[.N29]+1 -> 23 | O30: GND | P30: Power | U30: of:=[.U29]+1 -> 23 | V30: LA19_N | W30: SIO | X30: IO | Y30: EXT_52
B31: of:=[.B30]+1 -> 24 | C31: GND | D31: Power | H31: of:=[.H30]+1 -> 24 | I31: LA23_N | J31: SIO | K31: IO | L31: NC | N31: of:=[.N30]+1 -> 24 | O31: LA22_P | P31: SIO | Q31: IO | R31: EXT_55 | U31: of:=[.U30]+1 -> 24 | V31: GND | W31: Power
B32: of:=[.B31]+1 -> 25 | C32: GND | D32: Power | H32: of:=[.H31]+1 -> 25 | I32: GND | J32: Power | N32: of:=[.N31]+1 -> 25 | O32: LA22_N | P32: SIO | Q32: IO | R32: EXT_57 | U32: of:=[.U31]+1 -> 25 | V32: LA21_P | W32: SIO | X32: IO | Y32: EXT_56
B33: of:=[.B32]+1 -> 26 | C33: LA27_P | D33: SIO | E33: IO | F33: PB3 | H33: of:=[.H32]+1 -> 26 | I33: LA26_P | J33: SIO | K33: IO | L33: NC | N33: of:=[.N32]+1 -> 26 | O33: GND | P33: Power | U33: of:=[.U32]+1 -> 26 | V33: LA21_P | W33: SIO | X33: IO | Y33: EXT_58
B34: of:=[.B33]+1 -> 27 | C34: LA27_N | D34: SIO | E34: IO | F34: PB1 | H34: of:=[.H33]+1 -> 27 | I34: LA26_P | J34: SIO | K34: IO | L34: NC | N34: of:=[.N33]+1 -> 27 | O34: LA25_P | P34: SIO | Q34: IO | R34: NC | U34: of:=[.U33]+1 -> 27 | V34: GND | W34: Power
B35: of:=[.B34]+1 -> 28 | C35: GND | D35: Power | H35: of:=[.H34]+1 -> 28 | I35: GND | J35: Power | N35: of:=[.N34]+1 -> 28 | O35: LA25_N | P35: SIO | Q35: IO | R35: NC | U35: of:=[.U34]+1 -> 28 | V35: LA24_P | W35: SIO | X35: IO | Y35: NC
B36: of:=[.B35]+1 -> 29 | C36: GND | D36: Power | H36: of:=[.H35]+1 -> 29 | I36: TCK | J36: JTAG | N36: of:=[.N35]+1 -> 29 | O36: GND | P36: Power | U36: of:=[.U35]+1 -> 29 | V36: LA24_N | W36: SIO | X36: IO | Y36: NC
B37: of:=[.B36]+1 -> 30 | C37: SCL | D37: PS | H37: of:=[.H36]+1 -> 30 | I37: TDI | J37: JTAG | N37: of:=[.N36]+1 -> 30 | O37: LA29_P | P37: SIO | Q37: IO | R37: NC | U37: of:=[.U36]+1 -> 30 | V37: GND | W37: Power
B38: of:=[.B37]+1 -> 31 | C38: SDA | D38: PS | H38: of:=[.H37]+1 -> 31 | I38: TDO | J38: JTAG | N38: of:=[.N37]+1 -> 31 | O38: LA29_N | P38: SIO | Q38: IO | R38: NC | U38: of:=[.U37]+1 -> 31 | V38: LA28_P | W38: SIO | X38: IO | Y38: NC
B39: of:=[.B38]+1 -> 32 | C39: GND | D39: Power | H39: of:=[.H38]+1 -> 32 | I39: 3V3AUX | J39: Power | N39: of:=[.N38]+1 -> 32 | O39: GND | P39: Power | U39: of:=[.U38]+1 -> 32 | V39: LA28_N | W39: SIO | X39: IO | Y39: NC
B40: of:=[.B39]+1 -> 33 | C40: GND | D40: Power | H40: of:=[.H39]+1 -> 33 | I40: TMS | J40: JTAG | N40: of:=[.N39]+1 -> 33 | O40: LA31_P | P40: SIO | Q40: IO | R40: NC | U40: of:=[.U39]+1 -> 33 | V40: GND | W40: Power
B41: of:=[.B40]+1 -> 34 | C41: GA0 | D41: Config | H41: of:=[.H40]+1 -> 34 | I41: TRST_L | J41: JTAG | N41: of:=[.N40]+1 -> 34 | O41: LA31_N | P41: SIO | Q41: IO | R41: NC | U41: of:=[.U40]+1 -> 34 | V41: LA30_P | W41: SIO | X41: IO | Y41: NC
B42: of:=[.B41]+1 -> 35 | C42: 12V0 | D42: Power | H42: of:=[.H41]+1 -> 35 | I42: GA1 | J42: Config | N42: of:=[.N41]+1 -> 35 | O42: GND | P42: Power | U42: of:=[.U41]+1 -> 35 | V42: LA30_N | W42: SIO | X42: IO | Y42: NC
B43: of:=[.B42]+1 -> 36 | C43: GND | D43: Power | H43: of:=[.H42]+1 -> 36 | I43: 3V3 | J43: Power | N43: of:=[.N42]+1 -> 36 | O43: LA33_P | P43: SIO | R43: NC | U43: of:=[.U42]+1 -> 36 | V43: GND | W43: Power
B44: of:=[.B43]+1 -> 37 | C44: 12V0 | D44: Power | H44: of:=[.H43]+1 -> 37 | I44: GND | J44: Power | N44: of:=[.N43]+1 -> 37 | O44: LA33_N | P44: SIO | R44: NC | U44: of:=[.U43]+1 -> 37 | V44: LA32_P | W44: SIO | X44: IO | Y44: NC
B45: of:=[.B44]+1 -> 38 | C45: GND | D45: Power | H45: of:=[.H44]+1 -> 38 | I45: 3V3 | J45: Power | N45: of:=[.N44]+1 -> 38 | O45: GND | P45: Power | U45: of:=[.U44]+1 -> 38 | V45: LA32_N | W45: SIO | X45: IO | Y45: NC
B46: of:=[.B45]+1 -> 39 | C46: 3V3 | D46: Power | H46: of:=[.H45]+1 -> 39 | I46: GND | J46: Power | N46: of:=[.N45]+1 -> 39 | O46: VADJ | P46: Power | U46: of:=[.U45]+1 -> 39 | V46: GND | W46: Power
B47: of:=[.B46]+1 -> 40 | C47: GND | D47: Power | H47: of:=[.H46]+1 -> 40 | I47: 3V3 | J47: Power | N47: of:=[.N46]+1 -> 40 | O47: GND | P47: Power | U47: of:=[.U46]+1 -> 40 | V47: VADJ | W47: Power
B50: Key | C50: Description
B51: Power | C51: Power or ground
B52: PS | C52: Processing system sourced
B53: Config | C53: Configuration pins
B54: SIO | C54: Sys I/O
B55: MGT | C55: Multi-Gig Transceivers